{
  "schema_version": "authz.v1",
  "request_id": "req-fixture-1",
  "decision": "deny",
  "reason_code": "invalid_request",
  "status_hint": 400,
  "cache_ttl_seconds": 0,
  "policy_version": "policy-v1",
  "resource_version": "resource-v1",
  "audit": {
    "request_hash": "4c6aa3507ecdadddfff3d9f7ba7f3c1404bbac1d2562abf79a58b1fa74d82222",
    "policy_hash": "b511ef57d220623cd226a410d646fde78f2aa97ddc5f339947b20dbd9dc7e762"
  }
}
