{
  "schema_version": "authz.v1",
  "request_id": "req-fixture-1",
  "decision": "deny",
  "reason_code": "unsafe_resource_uri",
  "status_hint": 400,
  "cache_ttl_seconds": 0,
  "policy_version": "policy-v1",
  "resource_version": "resource-v1",
  "audit": {
    "request_hash": "8675bdef3124ba51b35e93941b14f3ff975a80dbbd0fa68ac9f2ade74db7a67e",
    "policy_hash": "b511ef57d220623cd226a410d646fde78f2aa97ddc5f339947b20dbd9dc7e762"
  }
}
