{
  "schema_version": "authz.v1",
  "request_id": "req-policy-inputs",
  "decision": "abstain",
  "reason_code": "kernel_abstain_shadow_mode",
  "cache_ttl_seconds": 0,
  "policy_version": "sha256:73d357d8cdef9369d4dab4a012803b3b29f360c883c0a1fd9dc9b58143894823",
  "resource_version": "resource-v1",
  "audit": {
    "request_hash": "5072427759a02b947f2f125f4f78209744bb38092e8b7147c89625c94f0c0d6c",
    "policy_hash": "73d357d8cdef9369d4dab4a012803b3b29f360c883c0a1fd9dc9b58143894823"
  }
}
